{
  "is_buffet": false,
  "effective": 4524452454,
  "expires": 124325512342,
  "item_list": [
    {
      "fullname": "Chicken Soup",
      "price": 1.3,
      "comment": "Homestyle and cheap, what more could you want?",
      "sort_id": 1,
      "options": {
        "add bacon bits": 0.5
      }
    },
    {
      "fullname": "Pizza",
      "price": 4.5,
      "comment": "American Grease",
      "sort_id": 2,
      "options": {
        "add sosig": 0.5
      }
    }
  ]
}